website	pmid	study	first_author	year	date_searched	search_terms_used	review_status	comments	detailed_comments	nih_non_nih	x12	year5bin
https://pubmed.ncbi.nlm.nih.gov/16507908	16507908	Detection and localization of PrPSc in the skeletal muscle of patients with variant, iatrogenic, and sporadic forms of Creutzfeldt-Jakob disease	Peden AH	2006	2022-06-10	Comoy 2022	excluded	no nhp data	human study		2005	2005
https://pubmed.ncbi.nlm.nih.gov/16940522	16940522	Transmission of elk and deer prions to transgenic mice	Tamgüney G	2006	2022-06-10	Comoy 2022	excluded	no nhp data	mice		2005	2005
https://pubmed.ncbi.nlm.nih.gov/17012296	17012296	Facial onset sensory and motor neuronopathy (FOSMN syndrome): a novel syndrome in neurology	Vucic S	2006	2022-06-10	Comoy 2022	excluded	no nhp data	other proteinopathies		2005	2005
https://pubmed.ncbi.nlm.nih.gov/16135751	16135751	Chronic wasting disease of elk: transmissibility to humans examined by transgenic mouse models	Kong Q	2005	2022-06-10	Comoy 2022	excluded	no nhp data	mice		2005	2005
https://pubmed.ncbi.nlm.nih.gov/14970340	14970340	Identification of a second bovine amyloidotic spongiform encephalopathy: molecular similarities with sporadic Creutzfeldt-Jakob disease	Casalone C	2004	2022-06-10	Comoy 2022	excluded	no nhp data	cattle		2000	2000
https://pubmed.ncbi.nlm.nih.gov/14710195	14710195	Distinct molecular phenotypes in bovine prion diseases	Biacabe AG	2004	2022-06-10	Comoy 2022	excluded	no nhp data	cattle		2000	2000
https://pubmed.ncbi.nlm.nih.gov/15221931	15221931	Prevalence of lymphoreticular prion protein accumulation in UK tissue samples	Hilton DA	2004	2022-06-10	Comoy 2022	excluded	no nhp data	human study		2000	2000
https://pubmed.ncbi.nlm.nih.gov/12713742	12713742	Factors determining the pattern of the variant Creutzfeldt-Jakob disease (vCJD) epidemic in the UK	Ghani AC	2003	2022-06-10	Comoy 2022	excluded	no nhp data	human study		2000	2000
https://pubmed.ncbi.nlm.nih.gov/11862621	11862621	The transmission dynamics of BSE and vCJD	Ghani AC	2002	2022-06-10	Comoy 2022	excluded	no nhp data	human study		2000	2000
https://pubmed.ncbi.nlm.nih.gov/11786878	11786878	Estimating the human health risk from possible BSE infection of the British sheep flock	Ferguson NM	2002	2022-06-10	Comoy 2022	excluded	no nhp data	human study		2000	2000
https://pubmed.ncbi.nlm.nih.gov/11476832	11476832	Tissue distribution of protease resistant prion protein in variant Creutzfeldt-Jakob disease using a highly sensitive immunoblotting assay	Wadsworth JD	2001	2022-06-10	Comoy 2022	excluded	no nhp data	human study		2000	2000
https://pubmed.ncbi.nlm.nih.gov/11186305	11186305	Scrapie infections initiated at varying doses: an analysis of 117 titration experiments	McLean AR	2000	2022-06-10	Comoy 2022	excluded	no nhp data	mice		2000	2000
https://pubmed.ncbi.nlm.nih.gov/11041403	11041403	Transmission of BSE by blood transfusion in sheep	Houston F	2000	2022-06-10	Comoy 2022	excluded	no nhp data	sheep		2000	2000
https://pubmed.ncbi.nlm.nih.gov/9492810	9492810	Post-exposure prophylaxis after accidental prion inoculation	Van Ranst M	1998	2022-06-10	Comoy 2022	excluded	review article			1995	1995
https://pubmed.ncbi.nlm.nih.gov/9388404	9388404	Post-exposure prophylaxis after accidental prion inoculation	Aguzzi A	1997	2022-06-10	Comoy 2022	excluded	review article			1995	1995
https://pubmed.ncbi.nlm.nih.gov/9333239	9333239	Transmissions to mice indicate that 'new variant' CJD is caused by the BSE agent	Bruce ME	1997	2022-06-10	Comoy 2022	excluded	no nhp data	mice		1995	1995
https://pubmed.ncbi.nlm.nih.gov/8524411	8524411	Unaltered susceptibility to BSE in transgenic mice expressing human prion protein	Collinge J	1995	2022-06-10	Comoy 2022	excluded	no nhp data	humanized mice		1995	1995
https://pubmed.ncbi.nlm.nih.gov/7654073	7654073	Intracerebral distribution of infectious amyloid protein in spongiform encephalopathy	Brown P	1995	2022-06-10	Comoy 2022	excluded	no nhp data	human study		1995	1995
https://pubmed.ncbi.nlm.nih.gov/7913758	7913758	Transmission of bovine spongiform encephalopathy and scrapie to mice: strain variation and the species barrier	Bruce M	1994	2022-06-10	Comoy 2022	excluded	no nhp data	mice		1990	1990
https://pubmed.ncbi.nlm.nih.gov/7817514	7817514	Epidemiological observations on spongiform encephalopathies in captive wild animals in the British Isles	Kirkwood JK	1994	2022-06-10	Comoy 2022	excluded	no nhp data	various non-primate zoo animals		1990	1990
https://pubmed.ncbi.nlm.nih.gov/8432351	8432351	Excitotoxin lesions in primates as a model for Huntington's disease: histopathologic and neurochemical characterization	Ferrante RJ	1993	2022-06-10	Comoy 2022	excluded	no nhp data	other proteinopathies		1990	1990
https://pubmed.ncbi.nlm.nih.gov/8236676	8236676	Transmission of bovine spongiform encephalopathy to sheep and goats	Foster JD	1993	2022-06-10	Comoy 2022	excluded	no nhp data	sheep, goats		1990	1990
https://pubmed.ncbi.nlm.nih.gov/2139853	2139853	A primate model of Huntington's disease: behavioral and anatomical studies of unilateral excitotoxic lesions of the caudate-putamen in the baboon	Hantraye P	1990	2022-06-10	Comoy 2022	excluded	no nhp data	other proteinopathies		1990	1990
https://pubmed.ncbi.nlm.nih.gov/2333092	2333092	BSE: spongiform encephalopathy found in cat	Aldhous P	1990	2022-06-10	Comoy 2022	excluded	no nhp data	cats		1990	1990
https://pubmed.ncbi.nlm.nih.gov/2264242	2264242	Spongiform encephalopathy in an arabian oryx (Oryx leucoryx) and a greater kudu (Tragelaphus strepsiceros)	Kirkwood JK	1990	2022-06-10	Comoy 2022	excluded	no nhp data	various non-primate zoo animals		1990	1990
https://pubmed.ncbi.nlm.nih.gov/6192438	6192438	A primate model of parkinsonism: selective destruction of dopaminergic neurons in the pars compacta of the substantia nigra by N-methyl-4-phenyl-1,2,3,6-tetrahydropyridine	Burns RS	1983	2022-06-10	Comoy 2022	excluded	no nhp data	other proteinopathies		1980	1980
https://pubmed.ncbi.nlm.nih.gov/120379	120379	Pathogenesis of mouse scrapie: dynamics of agent replication in spleen, spinal cord and brain after infection by different routes	Kimberlin RH	1979	2022-06-10	Comoy 2022	excluded	no nhp data	mice		1975	1975
https://pubmed.ncbi.nlm.nih.gov/65575	65575	Danger of accidental person-to-person transmission of Creutzfeldt-Jakob disease by surgery	Bernoulli C	1977	2022-06-10	Comoy 2022	excluded	no nhp endpoint data	mentions 3 chimpanzees but experiment is in progress as of writing with no results yet		1975	1975
https://pubmed.ncbi.nlm.nih.gov/13483871	13483871	Degenerative disease of the central nervous system in New Guinea; the endemic occurrence of kuru in the native population	GAJDUSEK DC	1957	2022-06-10	Comoy 2022	excluded	no nhp data	human study		1955	1955
