website	pmid	study	first_author	year	date_searched	search_terms_used	review_status	comments	detailed_comments	nih_non_nih	x12	year5bin
https://pubmed.ncbi.nlm.nih.gov/1602815	1602815	Murine leukemia virus induced central nervous system diseases	Wong PK	1992	2022-06-02	see Methods	excluded	no nhp data	no prion infection		1990	1990
https://pubmed.ncbi.nlm.nih.gov/1338060	1338060	Scrapie-associated tubulofilamentous particles in scrapie hamsters	Narang HK	1992	2022-06-02	see Methods	excluded	no nhp data			1990	1990
https://pubmed.ncbi.nlm.nih.gov/1683708	1683708	Transmissible familial Creutzfeldt-Jakob disease associated with five, seven, and eight extra octapeptide coding repeats in the PRNP gene	Goldfarb LG	1991	2022-06-02	see Methods	done	paragraph under -experimental transmission-			1990	1990
https://pubmed.ncbi.nlm.nih.gov/1684754	1684754	The phenotypic expression of different mutations in transmissible familial Creutzfeldt-Jakob disease	Brown P	1991	2022-06-02	see Methods	done	table 4 and 5			1990	1990
https://pubmed.ncbi.nlm.nih.gov/1684756	1684756	Familial Creutzfeldt-Jakob disease in Finland: epidemiological, clinical, pathological and molecular genetic studies	Haltia M	1991	2022-06-02	see Methods	excluded	all animals included in other publications			1990	1990
https://pubmed.ncbi.nlm.nih.gov/1685642	1685642	Spontaneous neurodegeneration in transgenic mice with prion protein codon 101 proline----leucine substitution	Hsiao K	1991	2022-06-02	see Methods	excluded	no nhp data			1990	1990
https://pubmed.ncbi.nlm.nih.gov/2190106	2190106	Alpha 1-antichymotrypsin is associated solely with amyloid deposits containing the beta-protein. Amyloid and cell localization of alpha 1-antichymotrypsin	Abraham CR	1990	2022-06-02	see Methods	excluded	no nhp data	no prion infection		1990	1990
https://pubmed.ncbi.nlm.nih.gov/2405293	2405293	Coexistence of Creutzfeldt-Jakob disease and Alzheimer's disease in the same patient	Brown P	1990	2022-06-02	see Methods	done	2 animals, IDs not stated			1990	1990
https://pubmed.ncbi.nlm.nih.gov/2564168	2564168	Linkage of a prion protein missense variant to Gerstmann-Sträussler syndrome	Hsiao K	1989	2022-06-02	see Methods	excluded	no nhp data	no prion infection		1985	1985
https://pubmed.ncbi.nlm.nih.gov/2546359	2546359	A neuropathological subset of Alzheimer's disease with concomitant Lewy body disease and spongiform change	Hansen LA	1989	2022-06-02	see Methods	excluded	no nhp endpoint data	no prion infection		1985	1985
https://pubmed.ncbi.nlm.nih.gov/3407098	3407098	Psoriatic plaques in Macaca fascicularis	Jayo MJ	1988	2022-06-02	see Methods	excluded	no nhp endpoint data	no prion infection		1985	1985
https://pubmed.ncbi.nlm.nih.gov/2908139	2908139	Prion protein gene expression in cultured cells	Scott MR	1988	2022-06-02	see Methods	excluded	no nhp data	no prion infection		1985	1985
https://pubmed.ncbi.nlm.nih.gov/3213434	3213434	Lesions akin to transmissible spongiform encephalopathy in the brains of rats inoculated with immature cerebellum. Their significance in the aetiology of these diseases	Beck E	1988	2022-06-02	see Methods	excluded	no nhp data	no prion infection		1985	1985
https://pubmed.ncbi.nlm.nih.gov/3124494	3124494	The maxillary sinus in the higher primates	Lund VJ	1988	2022-06-02	see Methods	excluded	no nhp endpoint data	no prion infection		1985	1985
https://pubmed.ncbi.nlm.nih.gov/3530120	3530120	Familial myoclonic dementia masquerading as Creutzfeldt-Jakob disease	Little BW	1986	2022-06-02	see Methods	excluded	no nhp endpoint data	no prion infection		1985	1985
https://pubmed.ncbi.nlm.nih.gov/3550507	3550507	Transmissible virus dementia: evaluation of a zoonotic hypothesis	Davanipour Z	1986	2022-06-02	see Methods	excluded	no nhp data	no prion infection		1985	1985
https://pubmed.ncbi.nlm.nih.gov/3923483	3923483	The 200- and 150-kDa neurofilament proteins react with IgG autoantibodies from chimpanzees with kuru or Creutzfeldt-Jakob disease; a 62-kDa neurofilament-associated protein reacts with sera from sheep with natural scrapie	Toh BH	1985	2022-06-02	see Methods	excluded	no nhp endpoint data	nhp serum immunoreactivity study, no endpoint times stated		1985	1985
https://pubmed.ncbi.nlm.nih.gov/2582415	2582415	The 200- and 150-kDa neurofilament proteins react with IgG autoantibodies from patients with kuru, Creutzfeldt-Jakob disease, and other neurologic diseases	Toh BH	1985	2022-06-02	see Methods	excluded	no nhp endpoint data	nhp serum immunoreactivity study, no endpoint times stated		1985	1985
https://pubmed.ncbi.nlm.nih.gov/3919881	3919881	Membrane lamellation in brain unrelated to spongiform encephalopathy	Gray EG	1985	2022-06-02	see Methods	excluded	no nhp endpoint data	no prion infection		1985	1985
https://pubmed.ncbi.nlm.nih.gov/6385823	6385823	Creutzfeldt-Jakob disease of long duration: clinicopathological characteristics, transmissibility, and differential diagnosis	Brown P	1984	2022-06-02	see Methods	excluded	not enough details	variety of species used, details not stated		1980	1980
https://pubmed.ncbi.nlm.nih.gov/6377496	6377496	Infection-specific particle from the unconventional slow virus diseases	Merz PA	1984	2022-06-02	see Methods	excluded	no nhp endpoint data	electron microscopy study, used nhp tissue but no endpoint times stated		1980	1980
https://pubmed.ncbi.nlm.nih.gov/6376717	6376717	Characterization of antineurofilament autoantibodies in Creutzfeldt-Jakob disease	Bahmanyar S	1984	2022-06-02	see Methods	excluded	all animals included in other publications	animal A81		1980	1980
https://pubmed.ncbi.nlm.nih.gov/6539361	6539361	The sequential development of spongiform change and gliosis of scrapie in the golden Syrian hamster	Masters CL	1984	2022-06-02	see Methods	excluded	no nhp data			1980	1980
https://pubmed.ncbi.nlm.nih.gov/6377682	6377682	Creutzfeldt-Jakob disease: experimental transmission in the guinea pig	Drăgănescu N	1984	2022-06-02	see Methods	excluded	no nhp data			1980	1980
https://pubmed.ncbi.nlm.nih.gov/6351721	6351721	Syndromes of amyotrophic lateral sclerosis and dementia: relation to transmissible Creutzfeldt-Jakob disease	Salazar AM	1983	2022-06-02	see Methods	excluded	not enough details			1980	1980
https://pubmed.ncbi.nlm.nih.gov/6854352	6854352	A clinico-pathological study of a case of kuru	Scrimgeour EM	1983	2022-06-02	see Methods	done				1980	1980
https://pubmed.ncbi.nlm.nih.gov/7139254	7139254	The pathogenesis of transmissible spongiform encephalopathy: an ultrastructural study	Beck E	1982	2022-06-02	see Methods	excluded	not enough details	inoculation details not stated here, cited to Beck 1975, for which full text unavailable. of animals in this study, only one reached symptom onset, animal S317 at 94 months.		1980	1980
https://pubmed.ncbi.nlm.nih.gov/6815090	6815090	Heterogeneic autoantibody against neurofilament protein in the sera of animals with experimental kuru and Creutzfeldt-Jakob disease and natural scrapie infection	Aoki T	1982	2022-06-02	see Methods	excluded	no nhp endpoint data			1980	1980
https://pubmed.ncbi.nlm.nih.gov/7142450	7142450	The syndrome of unilateral neglect in experimental kuru in the monkey: facts and hypotheses	Vuillon-Cacciuttolo G	1982	2022-06-02	see Methods	done	details in text			1980	1980
https://pubmed.ncbi.nlm.nih.gov/6285859	6285859	Persistent asymptomatic infection of the laboratory mouse by simian foamy virus type 6: a new model of retrovirus latency	Brown P	1982	2022-06-02	see Methods	excluded	no nhp data	no prion infection		1980	1980
https://pubmed.ncbi.nlm.nih.gov/7032197	7032197	Experimental transmission of Creutzfeldt-Jakob disease to guinea pigs	Chino F	1981	2022-06-02	see Methods	excluded	no nhp data			1980	1980
https://pubmed.ncbi.nlm.nih.gov/7032196	7032196	Experimental transmission of Creutzfeldt-Jakob disease and related diseases to rodents	Tateishi J	1981	2022-06-02	see Methods	excluded	no nhp data			1980	1980
https://pubmed.ncbi.nlm.nih.gov/7023604	7023604	The familial occurrence of Creutzfeldt-Jakob disease and Alzheimer's disease	Masters CL	1981	2022-06-02	see Methods	excluded	all animals included in other publications			1980	1980
https://pubmed.ncbi.nlm.nih.gov/7018471	7018471	Transmissible spongiform encephalopathy (Creutzfeldt-Jakob disease). Atypical clinical and pathological findings	Schoene WC	1981	2022-06-02	see Methods	excluded	not enough details			1980	1980
https://pubmed.ncbi.nlm.nih.gov/7020057	7020057	Five cases of Creutzfeldt-Jakob disease: a clinical-pathological contribution	Allegranza A	1981	2022-06-02	see Methods	excluded	full text not found	requested scan & deliver from harvard libraries but has not arrived. no abstract		1980	1980
https://pubmed.ncbi.nlm.nih.gov/7010209	7010209	Biologic distinction between sporadic and familial Alzheimer disease by an in vitro cell fusion test	Moreau-Dubois MC	1981	2022-06-02	see Methods	excluded	no nhp data	no prion infection		1980	1980
https://pubmed.ncbi.nlm.nih.gov/7223377	7223377	Anatomical study of experimental kuru in the Rhesus monkey	Gambarelli D	1981	2022-06-02	see Methods	excluded	all animals included in other publications	previously reported in Bert 1978 and Vuillon-Cacciuttolo 1982		1980	1980
https://pubmed.ncbi.nlm.nih.gov/7002260	7002260	Transmission and scanning electron microscopy of spongiform change in Creutzfeldt-Jakob disease	Chou SM	1980	2022-06-02	see Methods	done				1980	1980
https://pubmed.ncbi.nlm.nih.gov/6775247	6775247	Evidence for and against the transmissibility of Alzheimer disease	Goudsmit J	1980	2022-06-02	see Methods	excluded	no nhp endpoint data	no prion infection		1980	1980
https://pubmed.ncbi.nlm.nih.gov/7191064	7191064	Presenile Alzheimer disease: amyloid plaques in the cerebellum	Pro JD	1980	2022-06-02	see Methods	excluded	no nhp data	no prion infection		1980	1980
https://pubmed.ncbi.nlm.nih.gov/6771400	6771400	Experimental kuru in the rhesus monkey. A clinical study	Comte-Devolx J	1980	2022-06-02	see Methods	excluded	all animals included in other publications			1980	1980
https://pubmed.ncbi.nlm.nih.gov/81763	81763	Experimental kuru in the rhesus monkey: a study of EEG modifications in the waking state and during sleep	Bert J	1978	2022-06-02	see Methods	done				1975	1975
https://pubmed.ncbi.nlm.nih.gov/98316	98316	Appearance of EEG changes reminiscent of a secondary generalized epilepsy in a rhesus monkey inoculated with a strain of kuru	Bert J	1978	2022-06-02	see Methods	excluded	all animals included in other publications			1975	1975
https://pubmed.ncbi.nlm.nih.gov/417327	417327	Human spongiform encephalopathies in marmoset monkeys (Saguinus sp.)	Peterson DA	1978	2022-06-02	see Methods	done				1975	1975
https://pubmed.ncbi.nlm.nih.gov/19605075	19605075	Precocious sleep modifications in the evolution of experimental Kuru in rhesus monkeys	Bert J	1977	2022-06-02	see Methods	excluded	all animals included in other publications	same rhesus macaques as Bert 1978		1975	1975
https://pubmed.ncbi.nlm.nih.gov/99678	99678	Current status of the search for virus in amyotrophic lateral sclerosis (ALS)	Norris FH Jr	1977	2022-06-02	see Methods	excluded	no nhp data	no prion infection		1975	1975
https://pubmed.ncbi.nlm.nih.gov/828865	828865	A transmissible subacute spongiform encephalopathy in a visitor to the eastern highlands of New Guinea	Grabow JD	1976	2022-06-02	see Methods	done				1975	1975
https://pubmed.ncbi.nlm.nih.gov/766554	766554	Cellular sensitization in kuru, Jakob-Creutzfeldt disease and multiple sclerosis: with a note on the biohazards of slow infection work	Field EJ	1975	2022-06-02	see Methods	excluded	no nhp endpoint data			1975	1975
https://pubmed.ncbi.nlm.nih.gov/1098420	1098420	Pathology of dendrites in subacute spongiform virus encephalopathies	Lampert PW	1975	2022-06-02	see Methods	excluded	no nhp endpoint data			1975	1975
https://pubmed.ncbi.nlm.nih.gov/1096568	1096568	Neuropathological studies in primates suffering from experimental kuru or Creutzfeldt-Jakob disease	Beck E	1975	2022-06-02	see Methods	excluded	review article	obtained via scan & deliver from harvard libraries. general overview of field. mentions chimpanzees from gajdusek papers, no original data		1975	1975
https://pubmed.ncbi.nlm.nih.gov/4854373	4854373	Spongy degeneration of grey matter in 3 children. Neuropathological report	Janota I	1974	2022-06-02	see Methods	excluded	no nhp data	no prion infection		1970	1970
https://pubmed.ncbi.nlm.nih.gov/4200638	4200638	Experimental kuru in the chimpanzee. A neuropathological study	Beck E	1973	2022-06-02	see Methods	done		only 1 new animal, A120		1970	1970
https://pubmed.ncbi.nlm.nih.gov/4611512	4611512	Transmission of experimental subacute spongiform encephalopathy (Creutzfeldzt-Jakob disease) from chimpanzee to chimpanzee	Cathala F	1973	2022-06-02	see Methods	done				1970	1970
https://pubmed.ncbi.nlm.nih.gov/4988714	4988714	Transmissible mink encephalopathy: experimental transmission to the squirrel monkey	Eckroade RJ	1970	2022-06-02	see Methods	done				1970	1970
https://pubmed.ncbi.nlm.nih.gov/5804726	5804726	Infection as the etiology of spongiform encephalopathy (Creutzfeldt-Jakob disease)	Gibbs CJ Jr	1969	2022-06-02	see Methods	done	A79 appear to be a new animal not captured elsewhere, A82 was captured previously in Lampert 1971 and Beck 1969			1965	1965
https://pubmed.ncbi.nlm.nih.gov/4979006	4979006	Degenerative diseases of the central nervous system transmissible to experimental animals	Beck E	1969	2022-06-02	see Methods	excluded	all animals included in other publications	mostly a review article; describes one novel animal inoculated with subacute presenile polioencephalopathy but it was unknown whether this was a prion disease		1965	1965
https://pubmed.ncbi.nlm.nih.gov/5661299	5661299	Creutzfeldt-Jakob disease (spongiform encephalopathy): transmission to the chimpanzee	Gibbs CJ Jr	1968	2022-06-02	see Methods	excluded	all animals included in other publications	animal A54		1965	1965
https://pubmed.ncbi.nlm.nih.gov/6069978	6069978	Discussion on kuru, scrapie and the experimental kuru-like syndrome in chimpanzees	Gajdusek C	1967	2022-06-02	see Methods	excluded	review article	book chapter obtained via scan and deliver		1965	1965
https://pubmed.ncbi.nlm.nih.gov/2276050/	2276050	Spongiform encephalopathy transmitted experimentally from Creutzfeldt-Jakob and familial Gerstmann-Sträussler-Scheinker diseases	Baker HF	1990	2022-06-24	Baker 1998	done				1990	1990
https://pubmed.ncbi.nlm.nih.gov/33025140	33025140	Direct neural transmission of vCJD/BSE in macaque after finger incision	Mikol J	2021	2022-06-10	Comoy 2022	done				2020	2020
https://pubmed.ncbi.nlm.nih.gov/33532912	33532912	Wide distribution of prion infectivity in the peripheral tissues of vCJD and sCJD patients	Douet JY	2021	2022-06-10	Comoy 2022	excluded	no nhp data	human study		2020	2020
https://pubmed.ncbi.nlm.nih.gov/34452489	34452489	The Cellular Prion Protein Increases the Uptake and Toxicity of TDP-43 Fibrils	Scialò C	2021	2022-06-10	Comoy 2022	excluded	no nhp data	cell culture study		2020	2020
https://pubmed.ncbi.nlm.nih.gov/33858518	33858518	Classical scrapie in small ruminants is caused by at least four different prion strains	Marín-Moreno A	2021	2022-06-10	Comoy 2022	excluded	no nhp data	sheep and goats		2020	2020
https://pubmed.ncbi.nlm.nih.gov/31876504	31876504	Creutzfeldt-Jakob disease: a systematic review of global incidence, prevalence, infectivity, and incubation	Uttley L	2020	2022-06-10	Comoy 2022	excluded	review article			2020	2020
https://pubmed.ncbi.nlm.nih.gov/32232565	32232565	Prevalence in Britain of abnormal prion protein in human appendices before and after exposure to the cattle BSE epizootic	Gill ON	2020	2022-06-10	Comoy 2022	excluded	no nhp data	human study		2020	2020
https://pubmed.ncbi.nlm.nih.gov/32626163	32626163	Update on chronic wasting disease (CWD) III	EFSA Panel on Biological Hazards (BIOHAZ)	2019	2022-06-10	Comoy 2022	excluded	review article			2015	2015
https://pubmed.ncbi.nlm.nih.gov/30670087	30670087	Transmission studies of chronic wasting disease to transgenic mice overexpressing human prion protein using the RT-QuIC assay	Race B	2019	2022-06-10	Comoy 2022	excluded	no nhp data	humanized mice		2015	2015
https://pubmed.ncbi.nlm.nih.gov/29652245	29652245	Prion Disease in Dromedary Camels, Algeria	Babelhadj B	2018	2022-06-10	Comoy 2022	excluded	no nhp data	camels		2015	2015
https://pubmed.ncbi.nlm.nih.gov/29450646	29450646	Evidence of amyloid-β cerebral amyloid angiopathy transmission through neurosurgery	Jaunmuktane Z	2018	2022-06-10	Comoy 2022	excluded	no nhp data	human study		2015	2015
https://pubmed.ncbi.nlm.nih.gov/29769333	29769333	Microglia Are Critical in Host Defense against Prion Disease	Carroll JA	2018	2022-06-10	Comoy 2022	excluded	no nhp data	mice		2015	2015
https://pubmed.ncbi.nlm.nih.gov/29505163	29505163	Generation of novel neuroinvasive prions following intravenous challenge	Aguilar-Calvo P	2018	2022-06-10	Comoy 2022	excluded	no nhp data	mice		2015	2015
https://pubmed.ncbi.nlm.nih.gov/29406965	29406965	Experimental sheep BSE prions generate the vCJD phenotype when serially passaged in transgenic mice expressing human prion protein	Joiner S	2018	2022-06-10	Comoy 2022	excluded	no nhp data	human study		2015	2015
https://pubmed.ncbi.nlm.nih.gov/29209767	29209767	Neuropathology of iatrogenic Creutzfeldt-Jakob disease and immunoassay of French cadaver-sourced growth hormone batches suggest possible transmission of tauopathy and long incubation periods for the transmission of Abeta pathology	Duyckaerts C	2018	2022-06-10	Comoy 2022	excluded	no nhp data	human study		2015	2015
https://pubmed.ncbi.nlm.nih.gov/29508058	29508058	Fatal Aβ cerebral amyloid angiopathy 4 decades after a dural graft at the age of 2 years	Hervé D	2018	2022-06-10	Comoy 2022	excluded	no nhp data	human study		2015	2015
https://pubmed.ncbi.nlm.nih.gov/28945221	28945221	α-synuclein interacts with PrP(C) to induce cognitive impairment through mGluR5 and NMDAR2B	Ferreira DG	2017	2022-06-10	Comoy 2022	excluded	no nhp data	mice		2015	2015
https://pubmed.ncbi.nlm.nih.gov/27641251	27641251	First case of chronic wasting disease in Europe in a Norwegian free-ranging reindeer	Benestad SL	2016	2022-06-10	Comoy 2022	excluded	no nhp data	cervids		2015	2015
https://pubmed.ncbi.nlm.nih.gov/26812492	26812492	Amyloid-β pathology and cerebral amyloid angiopathy are frequent in iatrogenic Creutzfeldt-Jakob disease after dural grafting	Frontzek K	2016	2022-06-10	Comoy 2022	excluded	no nhp data	human study		2015	2015
https://pubmed.ncbi.nlm.nih.gov/27016065	27016065	Dura mater is a potential source of Aβ seeds	Kovacs GG	2016	2022-06-10	Comoy 2022	excluded	no nhp data	human study		2015	2015
https://pubmed.ncbi.nlm.nih.gov/26709606	26709606	Creutzfeldt-Jakob disease and blood transfusion: updated results of the UK Transfusion Medicine Epidemiology Review Study	Urwin PJ	2016	2022-06-10	Comoy 2022	excluded	no nhp data	human study		2015	2015
https://pubmed.ncbi.nlm.nih.gov/25705888	25705888	Human prion protein sequence elements impede cross-species chronic wasting disease transmission	Kurt TD	2015	2022-06-10	Comoy 2022	excluded	no nhp data	humanized mice		2015	2015
https://pubmed.ncbi.nlm.nih.gov/26041899	26041899	Does the Presence of Scrapie Affect the Ability of Current Statutory Discriminatory Tests To Detect the Presence of Bovine Spongiform Encephalopathy?	Simmons MM	2015	2022-06-10	Comoy 2022	excluded	no nhp data	cattle and ruminants		2015	2015
https://pubmed.ncbi.nlm.nih.gov/25510416	25510416	Evidence for zoonotic potential of ovine scrapie prions	Cassard H	2014	2022-06-10	Comoy 2022	excluded	no nhp data	humanized mice		2010	2010
https://pubmed.ncbi.nlm.nih.gov/24445428	24445428	Variant Creutzfeldt-Jakob disease with extremely low lymphoreticular deposition of prion protein	Mead S	2014	2022-06-10	Comoy 2022	excluded	no nhp data	human study		2010	2010
https://pubmed.ncbi.nlm.nih.gov/24005412	24005412	Self-propagation of pathogenic protein aggregates in neurodegenerative diseases	Jucker M	2013	2022-06-10	Comoy 2022	excluded	review article			2010	2010
https://pubmed.ncbi.nlm.nih.gov/25437202	25437202	Prions in variably protease-sensitive prionopathy: an update	Zou WQ	2013	2022-06-10	Comoy 2022	excluded	review article			2010	2010
https://pubmed.ncbi.nlm.nih.gov/24129059	24129059	Prevalent abnormal prion protein in human appendixes after bovine spongiform encephalopathy epizootic: large scale survey	Gill ON	2013	2022-06-10	Comoy 2022	excluded	no nhp data	human study		2010	2010
https://pubmed.ncbi.nlm.nih.gov/24188521	24188521	Atypical scrapie prions from sheep and lack of disease in transgenic mice overexpressing human prion protein	Wadsworth JD	2013	2022-06-10	Comoy 2022	excluded	no nhp data	humanized mice		2010	2010
https://pubmed.ncbi.nlm.nih.gov/23171544	23171544	Differentiation of prions from L-type BSE versus sporadic Creutzfeldt-Jakob disease	Nicot S	2012	2022-06-10	Comoy 2022	excluded	no nhp data	mice, hamsters		2010	2010
https://pubmed.ncbi.nlm.nih.gov/22495232	22495232	Chronic wasting disease and atypical forms of bovine spongiform encephalopathy and scrapie are not transmissible to mice expressing wild-type levels of human prion protein	Wilson R	2012	2022-06-10	Comoy 2022	excluded	no nhp data	humanized mice		2010	2010
https://pubmed.ncbi.nlm.nih.gov/21592603	21592603	Pathogenesis of classical and atypical BSE in cattle	Balkema-Buschmann A	2011	2022-06-10	Comoy 2022	excluded	no nhp data	cattle		2010	2010
https://pubmed.ncbi.nlm.nih.gov/21778819	21778819	Aerosols: an underestimated vehicle for transmission of prion diseases?	Stitz L	2011	2022-06-10	Comoy 2022	excluded	review article			2010	2010
https://pubmed.ncbi.nlm.nih.gov/22028219	22028219	Pathogenic protein seeding in Alzheimer disease and other neurodegenerative disorders	Jucker M	2011	2022-06-10	Comoy 2022	excluded	review article			2010	2010
https://pubmed.ncbi.nlm.nih.gov/21249178	21249178	Aerosols transmit prions to immunocompetent and immunodeficient mice	Haybaeck J	2011	2022-06-10	Comoy 2022	excluded	no nhp data	mice		2010	2010
https://pubmed.ncbi.nlm.nih.gov/22172149	22172149	Isolation of prion with BSE properties from farmed goat	Spiropoulos J	2011	2022-06-10	Comoy 2022	excluded	no nhp data	goats		2010	2010
https://pubmed.ncbi.nlm.nih.gov/21084466	21084466	Increased susceptibility of human-PrP transgenic mice to bovine spongiform encephalopathy infection following passage in sheep	Plinston C	2011	2022-06-10	Comoy 2022	excluded	no nhp data	humanized mice		2010	2010
https://pubmed.ncbi.nlm.nih.gov/21445238	21445238	Sheep and goat BSE propagate more efficiently than cattle BSE in human PrP transgenic mice	Padilla D	2011	2022-06-10	Comoy 2022	excluded	no nhp data	humanized mice		2010	2010
https://pubmed.ncbi.nlm.nih.gov/20610667	20610667	Chronic wasting disease prions are not transmissible to transgenic mice overexpressing human prion protein	Sandberg MK	2010	2022-06-10	Comoy 2022	excluded	no nhp data	humanized mice		2010	2010
https://pubmed.ncbi.nlm.nih.gov/20070383	20070383	Variant CJD infection in the spleen of a neurologically asymptomatic UK adult patient with haemophilia	Peden A	2010	2022-06-10	Comoy 2022	excluded	no nhp data	human study		2010	2010
https://pubmed.ncbi.nlm.nih.gov/20922767	20922767	Large-scale immunohistochemical examination for lymphoreticular prion protein in tonsil specimens collected in Britain	de Marco MF	2010	2022-06-10	Comoy 2022	excluded	no nhp data	human study		2010	2010
https://pubmed.ncbi.nlm.nih.gov/20695009	20695009	Variably protease-sensitive prionopathy: a new sporadic disease of the prion protein	Zou WQ	2010	2022-06-10	Comoy 2022	excluded	no nhp data	human study		2010	2010
https://pubmed.ncbi.nlm.nih.gov/19618341	19618341	Transmissible mink encephalopathy - review of the etiology of a rare prion disease	Liberski PP	2009	2022-06-10	Comoy 2022	excluded	review article			2005	2005
https://pubmed.ncbi.nlm.nih.gov/19460798	19460798	Prevalence of disease related prion protein in anonymous tonsil specimens in Britain: cross sectional opportunistic survey	Clewley JP	2009	2022-06-10	Comoy 2022	excluded	no nhp data	human study		2005	2005
https://pubmed.ncbi.nlm.nih.gov/19334063	19334063	Variant Creutzfeldt-Jakob disease in France and the United Kingdom: Evidence for the same agent strain	Brandel JP	2009	2022-06-10	Comoy 2022	excluded	no nhp data	human study		2005	2005
https://pubmed.ncbi.nlm.nih.gov/19242475	19242475	Cellular prion protein mediates impairment of synaptic plasticity by amyloid-beta oligomers	Laurén J	2009	2022-06-10	Comoy 2022	excluded	no nhp data	in vitro study		2005	2005
https://pubmed.ncbi.nlm.nih.gov/18849286	18849286	Review. The epidemiology of kuru: monitoring the epidemic from its peak to its end	Alpers MP	2008	2022-06-10	Comoy 2022	excluded	review article			2005	2005
https://pubmed.ncbi.nlm.nih.gov/18183299	18183299	Prominent and persistent extraneural infection in human PrP transgenic mice infected with variant CJD	Béringue V	2008	2022-06-10	Comoy 2022	excluded	no nhp data	humanized mice		2005	2005
https://pubmed.ncbi.nlm.nih.gov/19046515	19046515	Transmission of atypical bovine prions to mice transgenic for human prion protein	Béringue V	2008	2022-06-10	Comoy 2022	excluded	no nhp data	humanized mice		2005	2005
https://pubmed.ncbi.nlm.nih.gov/18234793	18234793	Evaluation of the human transmission risk of an atypical bovine spongiform encephalopathy prion strain	Kong Q	2008	2022-06-10	Comoy 2022	excluded	no nhp data	humanized mice		2005	2005
https://pubmed.ncbi.nlm.nih.gov/16798390	16798390	Kuru in the 21st century--an acquired human prion disease with very long incubation periods	Collinge J	2006	2022-06-10	Comoy 2022	excluded	review article			2005	2005
https://pubmed.ncbi.nlm.nih.gov/16990547	16990547	Exogenous induction of cerebral beta-amyloidogenesis is governed by agent and host	Meyer-Luehmann M	2006	2022-06-10	Comoy 2022	excluded	no nhp data	other proteinopathies		2005	2005
